{"schema_version":"2.0.0","project_id":"project-neutral","project_name":"National B2B","author":"Raphael Rechberger","domain":"https://national-b2b.example","competitors":["https://competitor.example"],"competitor_preflight":[{"url":"https://competitor.example","status":"reachable_https","http_status":200,"final_url":"https://competitor.example","warning_code":null,"error_code":null}],"target_audience":"German B2B buyers","target_regions":["Germany"],"primary_region":"Germany","secondary_regions":[],"language":"de","business_goal":"Generate qualified national leads.","content_focus":"B2B consulting","brand_tone":"professionell_warm","capacity_hours_per_week":{"min":10,"max":15,"source":"briefing_confirmed","provisional":false},"workstreams":[],"missing_accesses":[],"gate_0":{"status":"pending","reviewer":"Raphael Rechberger","approved_at":null,"warnings":[],"operator_message":null},"created_at":"2026-08-20T12:00:00Z","status":"initialization","phases":{"step_0_kickoff":{"status":"pending"},"step_1_pillar_identification":{"status":"pending"},"step_1b_site_architecture":{"status":"pending"},"step_1c_pillar_templates":{"status":"pending"},"step_2_cluster_research":{"status":"pending"},"step_3_120_day_plan":{"status":"pending"},"step_3b_performance_check":{"status":"pending"},"step_4_execution":{"status":"pending"}},"artifacts":{"pillar_inventory":"outputs/1-pillar-themen.md","site_architecture_md":"outputs/1b-seitenarchitektur.md","site_architecture_html":"outputs/1b-menuestruktur.html","design_system_css":"standards/design-system.css","cluster_keywords_data":"outputs/2-cluster-themen-agentseo.csv","roadmap_plan":"outputs/3-plan.md","performance_check_log":"outputs/3b-performance-check.md"},"country":"DE","location_code":2276,"geo_targets":{"primary_engines":["google_classic"],"geo_focus":"citation_visibility"},"entities":{"brand_entity":"National B2B","brand_wikidata_id":null,"brand_sameas_urls":[],"core_services":[{"name":"B2B consulting","wikidata_id":null}]},"deployment_binding":{"brand_id":"brand-national-b2b","country_code":"DE","deployment_id":"dep-national-b2b-de","deployment_role":"primary","domain_ids":["domain-national-b2b"],"language":"de","legal_jurisdiction":"DE","locale":"de-DE","market_id":"de-de-germany","market_phase":"active","physical_location_ids":[],"provider_location_verification":{"location_name":"Germany","provider_id":"agentseo","provider_location_code":2276,"status":"verified","target_id":"agentseo-de-country","target_type":"country","verification_source":"provider_response","verified_at":"2026-08-17T00:00:00Z"},"search_engines":["google_classic"],"seo_operating_model":"national","service_area_ids":["service-area-germany"],"target_regions":["Germany"]},"source_binding":{"tenant_id":"tenant-neutral","project_id":"project-neutral","customer_id":"customer-national-b2b","market_id":"de-de-germany","deployment_id":"dep-national-b2b-de","language":"de","locale":"de-DE","country":"DE","provider_target_id":"agentseo-de-country","provider_location_code":2276,"deployment_sha256":"4c077577ca59efa355ba1a33d67624cb64d96df68182049945db216df7c1b38b","project_v2_sha256":"6f90149acf5d96110b7f34acd666612fa76929f904958544e46cb3a83a62b06b","intake_source_sha256":"68cf4c5938b8e44ba95650155ba8706b55627fe8017fbbb7d9ea1fb524b82526"}}
